id	created_utc	subreddit	title
1g7o5ks	2024-10	onguardforthee	Charlie Angus on X: When it comes to foreign political interference nothing matches the Israeli lobby who are all over parliament and NDP conventions. No surprise that Israeli media throw their support behind Poilievre who is mired in his own foreign interference scandal.
1g70w66	2024-10	onguardforthee	The NDP Nailing Lil’PP
1g1chdx	2024-10	onguardforthee	B.C. billionaire posts third large sign criticizing NDP ahead of the election
1fxijov	2024-10	onguardforthee	Someone updated Chip Wilson's anti-NDP sign outside his $80,000,000 home
1fw1c3v	2024-10	onguardforthee	B.C. NDP called 'communist' on sign outside of Lululemon founder Chip Wilson's mansion
1h1zvlo	2024-11	canada	Poilievre says Conservatives will vote against proposed Liberal GST holiday
1h0e4n5	2024-11	canada	Liberals comparing Poilievre to Trump won't work: The Trudeau government’s desperate attempt to regain popularity by branding Poilievre as Canada’s Trump is destined to fail
1gux3k7	2024-11	canada	Kelly McParland: Of the long list of Liberal blunders, immigration takes the cake
1gu6x8x	2024-11	canada	Painting Conservatives as ‘Trump-lite’ not a winning strategy for Liberals post-U.S. election, say strategists
1gu4pfp	2024-11	canada	More than half of Canadians say Trudeau should be replaced as Liberal Party leader, poll shows
1grzbtr	2024-11	canada	Opinion: Beware the spin around changes to Liberal immigration targets;  Yes, proposed cuts to planned future inflows are large. But those flows were historically high. The new targets are still above 2019 values
1gmvrrf	2024-11	canada	Who should lead the Liberals? 'None of the above,' poll finds
1gth08i	2024-11	canada	The Conservatives are gaining ground among young voters in Quebec. Will it translate to seats?
1gv2svh	2024-11	canada	NDP MP cautioned for wearing pin supporting Palestinians in the House of Commons
1glqc7p	2024-11	canada	Singh's party support shows 'concerning' drop in NDP-friendly regions: poll
1gvgc40	2024-11	onguardforthee	Singh Warns Liberals to ‘Stay Out’ of Canada Post Labour Dispute
1gse9z5	2024-11	onguardforthee	Conservatives claim Liberals want Canadians to 'eat bugs' as cricket plant reduces workforce
1h21t9t	2024-11	onguardforthee	Canada's Conservatives can't wait to surrender to Trump
1h21s74	2024-11	onguardforthee	Pierre Poilievre is bragging that he will vote against a GST Tax Holiday. Callous Conservatives joyfully vote to cut corporate taxes, but they scoff at help for middle-class Canadians.
1h0axuq	2024-11	onguardforthee	Conservatives already beginning to find out in the comments, including ridiculous amounts of cope.
1gzz2sm	2024-11	onguardforthee	Conservatives will cut the services you depend on like health care, dental care, diabetes medication, and child care. We won't let them.
1gxqn1j	2024-11	onguardforthee	"Conservative leader Pierre Poilievre responds to Justin Trudeau's statement that he will 'abide by international law,' for International Criminal Court arrest warrants for crimes against humanity &amp; war crimes, calling it proof of how 'radical and wildly woke' Trudeau has become.
"
1gxle3x	2024-11	onguardforthee	Pierre Poilievre, Canada's Trump-inspired conservative leader
1gwrzvz	2024-11	onguardforthee	A Conservative MP in Question Period just said that protestors should not be in front of anyone’s house. Agree. And the people of downtown Ottawa would like to have a word.
1gv18rt	2024-11	onguardforthee	Conservative Premier giving tax dollars to richest man in the world 
1gmqcfk	2024-11	onguardforthee	Could Canadian conservatives copy Trump’s anti-trans messaging?
1gjp9q8	2024-11	onguardforthee	Stephen Harper supporting Trump is all you need to know about the Conservative Party of Canada
1gjea91	2024-11	onguardforthee	Conservative filibuster costing millions of dollars, say NDP and Green MPs
1gi84e7	2024-11	onguardforthee	Alberta Conservatives Pass Climate Denial Resolution 12 to Celebrate CO2 Pollution
1ghu3gf	2024-11	onguardforthee	I wish more Canadians understood this (i.e. the reason why Conservatives want to defund the CBC).
1gh8w1r	2024-11	onguardforthee	Canadian Sikh groups point out Conservative Party’s reluctance to ask questions about foreign interference by India
1h0vb10	2024-11	onguardforthee	Saskatchewan NDP MLA gives powerful address after his kids were publicly outed as trans by Premier Scott Moe 
1gw77ew	2024-11	onguardforthee	"Jagmeet Singh: Tomorrow Justin Trudeau is caving to an NDP demand: A winter GST holiday.
"
1guzm89	2024-11	onguardforthee	NDP MP cautioned for wearing pin supporting Palestinians in the House of Commons
1gtt0kr	2024-11	onguardforthee	NDP fight to reverse federal return-to-work mandate
1gmvokb	2024-11	onguardforthee	BC NDP majority confirmed after Surrey-Guildford judicial recount wraps
1hnl0qs	2024-12	canada	Liberal MP Chahal urges Trudeau to stop ‘needless reflection’ and resign, accusing ‘cabal’ around Trudeau of a ‘reckless strategy’ of 'mutual political destruction’
1hm11vd	2024-12	canada	Sorry, not sorry: Liberals urge Trudeau to go
1hl1b8g	2024-12	canada	More than 50 Liberal MPs say Justin Trudeau should step down: CBC.
1hk390z	2024-12	canada	‘Vast majority’ of Liberal caucus wants Trudeau to resign, MP says
1hjl079	2024-12	canada	Chrystia Freeland pegged by some Liberal MPs as Justin Trudeau's successor if he resigns
1hiyn8t	2024-12	canada	Poilievre says House should be recalled as NDP vows to vote down Liberal government
1hij2uu	2024-12	canada	'Why would I enter a burning building?' Some Liberals say a chance at Trudeau's cabinet not worth it
1hhyzo8	2024-12	canada	Drive to dump Trudeau has momentum, Liberal MP says
1hh669i	2024-12	canada	Trudeau jokes that Liberals are like a 'family that fights in the holidays'
1hgkfvw	2024-12	canada	Poilievre calls on Singh to topple the Liberal government
1hgdum8	2024-12	canada	Joe Oliver: We're witnessing the implosion of the Trudeau Liberals in real time.
1hg11qp	2024-12	canada	Trudeau Addresses Liberals After Tumultuous Day, Vows to Continue Serving Canada
1hfjr3x	2024-12	canada	Liberal Housing Minister Sean Fraser resigns from Trudeau's cabinet, won’t seek re-election
1hdnass	2024-12	canada	Pierre Poilievre says it shouldn’t take Donald Trump to make the Liberals sort out a fentanyl crisis
1hdic0m	2024-12	canada	Canada’s Pierre Poilievre Era Will Begin in 2025;  He’ll likely win a majority and immediately kill all the Liberals’ sacred cows
1haqrii	2024-12	canada	Liberal government survives third Conservative non-confidence vote
1hajuax	2024-12	canada	Consistent polling figures show Liberals face situation where the 'public just stops listening'
1h8w4vg	2024-12	canada	Latest Liberal gun policies spark cynicism, amusement in firearm community; Many gun owners planning on turning over their firearms now sitting put until the next federal election, said one policy expert
1h6g1gi	2024-12	canada	GST holiday flops: Majority says it's not much help, 'purely electoral,' as Liberal popularity drops
1h5tw3b	2024-12	canada	Millennials helped elect Trudeau in 2015. Nearly a decade later, they’re turning to the Conservatives;  Polls suggest inflation, souring attitudes toward immigration and fatigue with the federal Liberals are changing generations that were once optimistic for change
1hoa58a	2024-12	canada	LeBlanc defends stay at Irving home as Conservatives call for review of ethics screen
1hioov6	2024-12	canada	LILLEY: Poilievre vows Canada will never be the 51st American state - In an exclusive interview, Conservative Leader Pierre Poilievre says Canada needs a leader with 'brains and backbone' to deal with Trump.
1h96bm5	2024-12	canada	CSIS to brief Conservative Leader Poilievre on national security threats despite his lack of clearance
1h85t56	2024-12	canada	NDP won't back Conservative non-confidence motion that borrows Singh's own words
1h7k5r4	2024-12	canada	Conservatives decry 'procedural nonsense' as NDP forces House debate on abortion - Surprise move sidelines Conservative non-confidence motion
1h63ljt	2024-12	canada	Singh won't support Conservative non-confidence motion that uses his own words
1h4r1am	2024-12	canada	Agents of Indian government interfered in Patrick Brown's Conservative leadership campaign: sources
1hk6fcu	2024-12	canada	338 Federal Projection: CPC 232 (+6), BQ 45, LPC 39 (-8), NDP 25 (+2), GP 2
1hjegsj	2024-12	canada	Poilievre pushes NDP, Bloc to join him in calling for House to be recalled
1hin0xe	2024-12	canada	Singh says the NDP 'will vote to bring this government down' in new letter
1hhbpfp	2024-12	canada	With Trudeau on the ropes, NDP's curious timing for toppling government questioned - MP Peter Julian says NDP would consider supporting non-confidence vote in 'Late Feb/Early January' — the same time Jagmeet Singh becomes pension-eligible
1hfrcdx	2024-12	canada	CP NewsAlert: NDP leader says Prime Minister Justin Trudeau should resign
1hbyek4	2024-12	canada	NDP leader 'deserved to be embarrassed' by non-confidence motion: Bloc leader
1hox79c	2024-12	onguardforthee	With the H-1B hubbub going on down south, let's remember
1hhyigj	2024-12	onguardforthee	N.B. Liberal government revises Policy 713, parental consent no longer required for students’ preferred names
1hfl556	2024-12	onguardforthee	Canada Post workers call for working class to mobilize in opposition to Liberal government’s strike ban
1haob9n	2024-12	onguardforthee	Liberal government survives third Conservative non-confidence vote
1h55uco	2024-12	onguardforthee	The latest attempt to bring down the minority Liberal government has stalled after the Conservatives blocked their own non-confidence motion from going ahead.
1h3rscm	2024-12	onguardforthee	Top New York Lawmaker Urges Liberal States to Secede from US, Join Canada in Response to Trump Mass Deportation Threat
1hnmodw	2024-12	onguardforthee	The Meta news ban, the downfall of Twitter and the rise of the Conservative Party of Canada
1hm9724	2024-12	onguardforthee	Trump endorses Wayne Gretzky for Prime Minister. Dec. 25th 2024.
1hhc4d6	2024-12	onguardforthee	US billionaires pumping for Poilievre. Leaving aside the foreign interference, this is extremely revealing about whose interests the Conservatives really serve
1hf55j1	2024-12	onguardforthee	Connect the dots: 1. Big corps buy up apartments. 2. AI is used to increase rent. 3. Their CEOs donate to Conservatives. Result? You pay. They get rich. Conservatives get donations. Pierre Poilievre is a Billionaire Bootlicker – and you’re paying the price. We're fighting for you – against this 
1hedqoq	2024-12	onguardforthee	Under Harper, the Conservatives denied 20,000 veterans’ funeral and burial applications, cut services, and disrespected our veterans. We can never trust them again to run Veterans Affairs or act in the public’s interest. Period.
1hcy4ff	2024-12	onguardforthee	She fought for people and made her province a better place. They said it was impossible - until she proved them wrong. @RachelNotley showed us how New Democrats can defeat Conservatives. It has been an honour to work with her. She has made Albertans proud. She has made New Democrats proud. 
1hbz00j	2024-12	onguardforthee	Last night, every single Conservative MP voted against: – Managing asylum seekers at the border – A National School Food Program – Dental coverage for seniors – New immigration screening systems – Canadian clean energy projects – The Kids Help Phone
1h86mh8	2024-12	onguardforthee	Every single #Conservative just voted in House against abortion rights. Tell your Conservative MP you’re disgusted that they want to take away a woman’s right to choose. We can’t repeat catastrophic increase in deaths of women in US due to denial of reproductive health rights.
1h7jidn	2024-12	onguardforthee	Conservatives aim 2 block not just abortion services but also discussions on women's reproductive rights in the House of Commons. This effort to silence debate reflects their intolerance, making it clear why Canadians should be concerned about a potential Conservative gov’t
1h7axq6	2024-12	onguardforthee	Former Conservative leadership candidate Patrick Brown to testify on Indian interference allegations
1h7arsw	2024-12	onguardforthee	Canada's conservative provinces are targeting transgender people
1h6pm52	2024-12	onguardforthee	“Pierre Poilievre and the Conservatives are bootlicking for billionaires”
1h5toh1	2024-12	onguardforthee	MP Peter Julian: Some Conservative MPs arrived drunk at the House of Commons last Thu night for the GST relief vote. They screamed, disrupted proceedings that parliamentary pages were removed from the unsafe opposition lobby. In most workplaces, showing up intoxicated is grounds 4 dismissal.
1h5r0o9	2024-12	onguardforthee	Pierre Poilievre and the Conservatives are ‘Bootlicking for Billionaires’
1h5g55x	2024-12	onguardforthee	Conservative MP Michelle Rempel Garner runs away from a CBC journalist who attempts to ask her about Indian interference in the Conservative Party of Canada leadership race
1h4ub02	2024-12	onguardforthee	Agents of Indian government interfered in Patrick Brown's Conservative leadership campaign: sources
1hn3l6l	2024-12	onguardforthee	Edmonton NDP MP urges Trudeau Government to adopt her private member’s bill to make it harder for provinces to quit the CPP
1hin9d0	2024-12	onguardforthee	Sing says NDP will vote to bring down Trudeau government
1hfrczc	2024-12	onguardforthee	CP NewsAlert: NDP leader says Prime Minister Justin Trudeau should resign
1hb80pe	2024-12	onguardforthee	"""Would you or would you not like Canada to become the 51st state of the United States?"" No: 82% Yes: 13% --- No Among: NDP: 94% LPC: 89% BQ: 88% GPC: 87% CPC: 73% PPC: 57% --- Leger / Dec 9, 2024 / n=1520 / Online"
1icsibr	2025-01	canada	Most Canadians don't believe Liberals will dump carbon tax: poll
1iccy8x	2025-01	canada	Singh suggests NDP could help Liberals pass Trump tariff relief
1ic2i04	2025-01	canada	Liberal party won’t say why MP Chandra Arya was disqualified from leadership race
1ialji8	2025-01	canada	Liberal leadership hopeful Chandra Arya says party informed him he can't enter the contest
1i9vjy4	2025-01	canada	Transport Minister Anita Anand endorses Mark Carney for Liberal leader
1i7nhj4	2025-01	canada	Liberals Break 30 Points Following Trump Inauguration
1i66qfn	2025-01	canada	Singh says NDP still plan to vote to topple Liberals ‘at the earliest opportunity,’ regardless of leader
1i50ejz	2025-01	canada	Foreign Affairs Minister Mélanie Joly to endorse Mark Carney for Liberal leader: sources
1i2yuf3	2025-01	canada	Former Bank of Canada governor Mark Carney launches campaign for Liberal leadership
1i2t7rl	2025-01	canada	Poilievre pledges to reverse Liberals’ capital gains tax changes if elected - National | Globalnews.ca
1i21ylw	2025-01	canada	Mark Carney to launch bid for the Liberal leadership in Edmonton on Thursday
1i20sf4	2025-01	canada	Christy Clark opts out of Liberal leadership race in order to run for NDP leader next year
1i1j0zn	2025-01	canada	Liberals prefer Mark Carney over Chrystia Freeland as next leader, poll suggests
1i16wv8	2025-01	canada	'I am an outsider': Carney rips Poilievre, makes Liberal leadership case on The Daily Show
1i129mz	2025-01	canada	Carney talks tariffs, Trump, Liberal leadership in Daily Show interview
1hzleih	2025-01	canada	Former PM Chretien says Liberal party must move back to 'radical centre'
1hz355a	2025-01	canada	Transport Minister Anita Anand won't run for Liberal leadership, won't seek re-election
1hz2fio	2025-01	canada	Questions remain about how Liberals missed deficit target by over $20-billion, says PBO - Disregarding fiscal anchors has become ‘a unique feature’ of the current government, says Chrétien-era Finance Canada official Eugene Lang. 
1hyjr95	2025-01	canada	Speak French, understand Quebec or don’t run for party leadership, some Liberals say
1hy95kz	2025-01	canada	Conservatives see highest lead yet over Liberals following Justin Trudeau’s resignation - CON 40%, LIB 17%, NDP 15%, BQ 7%, PPC 3%, GRN 3% (Abacus)
1hy53sy	2025-01	canada	Liberals will remove 'fraudulent' memberships, as some register their pets to vote
1hwodkv	2025-01	canada	Pierre Poilievre and Jagmeet Singh say they’ll try to trigger an election as soon as possible; Opposition parties argued that any Liberal leader will bear the burden of what they argue is Justin Trudeau’s legacy of bad public policy. 
1hvbd8j	2025-01	canada	Opinion: Justin Trudeau resigned too late. There is no salvaging the Liberal Party now
1hv5pel	2025-01	canada	Loonie gains as Wall Street weighs in on Trudeau's resignation - The Canadian dollar advanced after Canadian Prime Minister Justin Trudeau announced his resignation as head of the Liberal Party, triggering a contest to replace him as leader.
1hv2hpn	2025-01	canada	Justin Trudeau Resigns as the leader of the Liberal Party of Canada
1hv23bu	2025-01	canada	Trudeau to announce he's stepping down as Liberal leader: sources
1huavha	2025-01	canada	If Trudeau announces he’s stepping down, expect another cabinet shuffle, say Liberal sources
1icoqwm	2025-01	canada	Mark Carney has Canada’s Conservatives running scared
1icac41	2025-01	canada	NANOS poll: Conservative massive advantage declines in wake of Trudeau resignation
1ia0il6	2025-01	canada	Conservative Canadian PM hopeful Pierre Poilievre vows US will be 'hit hard' over Trump's tariffs if he's elected to replace Trudeau
1i7stdj	2025-01	canada	Conservatives say they could shrink federal workforce by 17,000 yearly by not replacing leavers
1i5zbuv	2025-01	canada	Musk's approval of Poilievre good for Conservatives, but may not sit well for others, say pollsters and strategists
1i3mwbx	2025-01	canada	With Conservatives promising to 'defund,' could the next election kill the CBC?
1i3jat2	2025-01	canada	Conservative Lead Narrows to 11 Points
1hrfaxx	2025-01	canada	 'Jack Layton is turning over in his grave': Ousted New Democrat decries party's antisemitism problem; Selena Robinson says progressive parties are unwisely aligning themselves with conservative Muslim groups that are anti-Israel
1i9pi0u	2025-01	canada	NDP MP Angus calls for investigation into Elon Musk over potential election interference - MP says Musk has the power to 'easily impact our electoral integrity'
1hzus4a	2025-01	canada	338Canada CPC: 237, BQ: 45, LPC: 37, NDP: 22, GPC: 2
1hxhmyh	2025-01	canada	Opinion | Trudeau’s resignation could have been a moment for Jagmeet Singh’s NDP. It was instead a reminder of how he’s failed
1hulh1h	2025-01	canada	338Canada | Projection: CPC 236 (+4), BQ 45, LPC 35 (-4), NDP 25, GP 2
1icyta1	2025-01	onguardforthee	Mark Carney now leads Chrystia Freeland by 40 points to become the next Liberal Party leader
1icd1b5	2025-01	onguardforthee	Singh suggests NDP could help Liberals pass Trump tariff relief
1ibqw51	2025-01	onguardforthee	If you misrepresent yourself as a Liberal Voter in the Leadership race, you can &amp; will be fined $10,000.
1ibmz0x	2025-01	onguardforthee	Liberal Party approves 6 candidates to run in leadership race
1ibeqfq	2025-01	onguardforthee	Conservatives on Twitter are bragging about registering for the Liberal Party to intentionally vote for bad candidates in the leadership race
1iba3sd	2025-01	onguardforthee	PSA: You have until 5pm ET TODAY to register to be eligible to vote for next liberal leader
1iagsir	2025-01	onguardforthee	PSA: You have until 5pm ET, Jan 27 to be eligible to vote for next liberal leader
1ia0j7u	2025-01	onguardforthee	Liberals Break 30 Points Following Trump Inauguration
1i9vwop	2025-01	onguardforthee	Transport Minister Anita Anand endorses Mark Carney for Liberal leader
1i96xh2	2025-01	onguardforthee	Conservative leader Pierre Poilievre blames global Netflix price increase on Liberals
1i7odfx	2025-01	onguardforthee	Liberals Break 30 Points Following Trump Inauguration
1i5169u	2025-01	onguardforthee	Foreign Affairs Minister Mélanie Joly to endorse Mark Carney for Liberal leader: source
1i303lq	2025-01	onguardforthee	Poilievre was also asked about whether he would back an export tax or restrictions on Canadian energy. He blames the Liberals for making Canada beholden to the U.S. to sell energy, but doesn't say if he supports an export tax or restriction.
1i1k0gz	2025-01	onguardforthee	Liberals prefer Mark Carney over Chrystia Freeland as next leader, poll suggests
1i0uxot	2025-01	onguardforthee	Stephen Harper said it's actually Canada subsidizing the U.S. on oil and gas and advocates for Canada to start looking at selling to other markets.
1hv8bnj	2025-01	onguardforthee	Charlie Angus: Canada is facing unprecedented pressure from Trump. Our parliament has become dysfunctional from Poilievre's political games and Liberal infighting. I thank Mr. Trudeau for his service to our country but he is in a political dead-end and has done the right thing.
1hv2iew	2025-01	onguardforthee	Trudeau resigning as Liberal leader; PM asked to prorogue Parliament until March 24
1hv05yf	2025-01	onguardforthee	I saw that Liberal sources had told Global News they felt Trudeau had pulled the party “too far to the left” and they seemed to think that was the problem with his leadership If that’s the takeaway the Liberals are going with, they are incredibly boned
1icj5mu	2025-01	onguardforthee	Mark Carney has Canada’s Conservatives running scared
1ic3k0a	2025-01	onguardforthee	Agents of Indian government interfered in Patrick Brown's Conservative leadership campaign: sources | CBC News
1ibn5p4	2025-01	onguardforthee	Important reading for anyone considering voting Conservative in October.
1ibkrh4	2025-01	onguardforthee	Conservative Lead shrinks in Newest Abacus Poll
1i892hu	2025-01	onguardforthee	"And so it begins... Trump's right hand is making jokes about some of the worst murderers in history. Conservative MPs have called him a ""breath of fresh air."" He is toxic. Canada needs to make sure that this Nazi promoter is not able to interfere in any way in our electoral system."
1i7hiv8	2025-01	onguardforthee	Musk’s approval of Poilievre good for Conservatives, but may not sit well for others, say pollsters and strategists
1i612vv	2025-01	onguardforthee	Musk's approval of Poilievre good for Conservatives, but may not sit well for others, say pollsters and strategists
1i3lzve	2025-01	onguardforthee	Inside the Conservative Party’s growing alliance with right-wing Hindu groups
1i3jt0g	2025-01	onguardforthee	Conservative Lead Narrows to 11 Points
1i29o2d	2025-01	onguardforthee	Watch this video! Conservative Premier Doug Ford comes just short of saying that Danielle Smith is dividing Canada and serving Trumps interests! “United we stand, divided we fall” What a place in history Smith is claiming for herself!
1hzy835	2025-01	onguardforthee	With Conservatives promising to ‘defund,’ could the next election kill the CBC?
1hyfxj5	2025-01	onguardforthee	Pierre Poilievre's senior advisor doubles as a Loblaw Lobbyist. Galen Weston has donated to his party. There is no chance Conservatives will ever stand up to Greedy CEOs no matter how many times they cheat you. If you want someone with the guts to take on CEOs - that's New Democrats.
1hxt82h	2025-01	onguardforthee	How Vote Splitting Helped Conservatives Win in My Riding
1hwxc4t	2025-01	onguardforthee	Canada's Conservative leader slams Trump's '51st state' idea
1hv59pk	2025-01	onguardforthee	Poilievre used misogynistic hashtags to draw in support from men who hate women on his YouTube. Now he’s promoting his video with a Russian proxy. Refuses to get a security clearance, while it’s clear the Conservative leadership race was compromised. Nothing to see here.
1hssiel	2025-01	onguardforthee	Wondering what the Conservatives will do to social programs if they return to power under Poilievre? He says all those “socialist policies” like public healthcare and the like are actually bad for the poor and redistribute toward the “super wealthy,” so they need to be cut.
1hslgys	2025-01	onguardforthee	Conservatives give in to their worst impulses with their ‘Wacko’ movie on Trudeau
1iawztx	2025-01	onguardforthee	Federal - Ontario Polling: LPC: 36% CPC: 34% NDP: 11% GPC: 4% PPC: 2% Undecided: 11% Mainstreet / Jan 26, 2025 / n=862 / Online
1i9qub2	2025-01	onguardforthee	NDP MP Angus calls for investigation into Elon Musk over potential election interference
1i89e2z	2025-01	onguardforthee	Surprise! NDP BC has lowest income taxes for average working person
1i4azie	2025-01	onguardforthee	The amount of misinformation, propaganda on FB regarding Jagmeet Singh is astonishing 
1hwprls	2025-01	onguardforthee	"""Would you or would you not like Canada to become the 51st state of the United States?"" No: 82% Yes: 13% --- No Among: NDP: 94% LPC: 89% BQ: 88% GPC: 87% CPC: 73% PPC: 57% --- Leger / Dec 9, 2024 / n=1520 / Online"
1iz0i4q	2025-02	canada	‘Basically a dead heat’: As Trump fears grow, federal Liberals keep bouncing back, pollster says
1iyt4wt	2025-02	canada	Anti-Trump sentiment drives dramatic upturn in fortunes for Canada’s Liberals
1iy7d00	2025-02	canada	ISOS: Liberals Take Lead for First Time Since 2021
1iy6w7z	2025-02	canada	Liberals top Tories for 1st time in years, new Ipsos polling says (LPC 38%, CPC 36%, NDP 12%, BQ 6%)
1ixm21r	2025-02	canada	Carney mistakenly says 'we agree with Hamas' in French Liberal leadership debate
1ix69un	2025-02	canada	Liberal leadership hopeful Mark Carney pledges temporary cap on immigration
1ix5s0t	2025-02	canada	Billionaires line up to support Mark Carney in Liberal leadership race
1ix475y	2025-02	canada	Trump’s tariffs have ‘just freaked everybody out': some senior Conservatives fear losing support to Liberals
1ivifmr	2025-02	canada	Ruby Dhalla kicked out of Liberal leadership race after 'extremely serious' violations: party
