id	created_utc	subreddit	title
1iuudbo	2025-02	canada	I was a longtime Liberal who swore off Trudeau. This is what changed for voters like me
1iugo19	2025-02	canada	Finance Minister Dominic LeBlanc endorses Mark Carney for Liberal leader
1iuecxd	2025-02	canada	Liberals want to nearly double CBC funding, as an investment in 'national security'
1itwj0i	2025-02	canada	Liberal Party questions leadership candidate Ruby Dhalla over possible interference from India
1isn0b1	2025-02	canada	Conservatives 39, Liberals 32, NDP 15, BQ 8, GPC 4, PPC 2 (Nanos)
1ismzok	2025-02	canada	Federal vote intention tightens to near-tie as Liberals and New Democrats rally around Carney (CPC 40%, LPC 37%, NDP 10%, BQ 7%, GRN 4%)
1iqyby5	2025-02	canada	Liberal leadership hopeful Mark Carney says he'd run a deficit to 'invest and grow' Canada's economy
1ipovmk	2025-02	canada	New Mainstreet poll shows the Liberals with a slim lead over the Conservatives if Carney was the leader (LPC 41%, CPC 38%, NDP 11%, BQ 6%, GPC 2%, PPC 1%)
1iomnc8	2025-02	canada	NDP expecting Mark Carney to win Liberal leadership, call early election
1io3r9b	2025-02	canada	Liberal leadership candidate Mark Carney takes aim at U.S. during Kelowna stop
1inglyl	2025-02	canada	Liberals now projected to win a majority with Mark Carney as party leader
1in73q1	2025-02	canada	Leger poll: Carney as leader would have Liberals tied with Conservatives
1in2gqq	2025-02	canada	Canada’s Liberal party was left for dead, but Trump might have just given it a second chance | Canada
1imbwzf	2025-02	canada	Make no mistake, Mark Carney will win the Liberal leadership
1ili7nq	2025-02	canada	A Carney Liberal leadership win would produce a political rarity: A PM who is not an MP
1ikto1f	2025-02	canada	Federal Liberals announce dates for leadership debates
1ik3apf	2025-02	canada	Liberals surge ahead of CPC in Quebec and Ontario due to ‘Mark Carney effect’
1ijaeze	2025-02	canada	Liberals Narrow Gap with Conservatives (CPC 41% (-5 since previous Ipsos poll) LPC 28% (+8) NDP 16% (-1) BQ 9% GPC 3% (+1) PPC 3% (-1)
1iirgp8	2025-02	canada	Donald Trump’s Gaza proposal would amount to ‘ethnic cleansing,’ Liberal MPs say
1it9ozc	2025-02	canada	Conservatives urge Mark Carney to proactively disclose any conflicts ahead of next election
1it9cfd	2025-02	canada	Conservatives say they'll go 'huge' on open banking if they win power
1iro5q0	2025-02	canada	Trump’s Threats Against Canada Upend Conservative’s Playbook
1iq7shp	2025-02	canada	EKOS Poll: Conservative Lead Holds at Five Points
1ip9a1j	2025-02	canada	Conservative caucus meets in Ottawa as poll numbers slump and Trump's threats loom
1innz7b	2025-02	canada	Trudeau calls out Poilievre after top Conservative adviser is tied to Loblaw lobbying | CBC News
1in6ori	2025-02	canada	KINSELLA: Trump anchor dragging down Poilievre’s Conservatives fast
1imbm3b	2025-02	canada	When will Canada's Conservatives finally stop making excuses for Donald Trump?
1ikunlt	2025-02	canada	Conservatives dominate federal party fundraising - The Conservative Party of Canada continues to raise more money than all of its federal competitors combined.
1ik7nix	2025-02	canada	Donald Trump may just cost Canada’s Conservatives the election
1ihm6nf	2025-02	canada	Poilievre's pivot: Conservatives conducting internal surveys to adapt message
1izt6kb	2025-02	canada	NDP MP joins workers in calling for Amazon boycott after Quebec closures
1izoznn	2025-02	canada	Trudeau shuts down NDP proposal to bar Trump from G7 summit
1iy9qtq	2025-02	canada	Another Federal Poll (EKOS) LIB 38.4, CON 37.0, NDP 11.8, BQ 4.2, GRN 4.2, PPC 3.1
1iwfove	2025-02	canada	338Canada | CPC 177 (-15), LPC 120 (+19), BQ 33 (-4), NDP 11, GPC 2
1ir523l	2025-02	canada	338Canada Federal (Feb. 16th Update): CPC 192(-13)(42%), LPC 101(+17)(29%), BQ 37(-3)(8%), NDP 11(-1)(8%), GPC 2(-)(4%), PPC 0(-)(2%)
1iqweq3	2025-02	canada	Canada National Poll, February 2025 Carney As Leader, LPC: 40% CPC: 37% NDP: 12% BQ: 9% GPC: 2% PPC: 1%
1ipre90	2025-02	canada	Mainstreet Federal Poll: CPC 41% LPC 37% NDP 11%
1ioqhx3	2025-02	canada	Mark Carney won’t rule out calling early election if he wins leadership, as NDP memo warns candidates to prepare
1in0lp2	2025-02	canada	Nanos Federal Poll via 338. CPC 38. LPC 30. NDP 16. BQ 8. GPC 5. PPC 2.
1imeb8t	2025-02	canada	NDP wants tariffs on Teslas and a $10K made-in-Canada EV rebate
1ilpkr7	2025-02	canada	338Canada Federal (Feb. 9th Update): CPC 205(-15)(42%), LPC 84(+21)(26%), BQ 40(-4)(8%), NDP 12(-3)(16%), GPC 2(+1)(4%), PPC 0(-)(2%)
1ige7cr	2025-02	canada	338 Canada | CPC 220 (-15), LPC 63 (+19), BQ 44 (+2), NDP 15 (-6), GPC 1
1iyogro	2025-02	onguardforthee	Liberals top Tories for 1st time in years, new Ipsos polling says
1iybdn1	2025-02	onguardforthee	Liberals Hold Statistically Insignificant Lead
1iy7ibd	2025-02	onguardforthee	Liberals top Tories for 1st time in years, new Ipsos polling says
1ixczug	2025-02	onguardforthee	Billionaires line up to support Mark Carney in Liberal leadership race
1irttk0	2025-02	onguardforthee	Ontario Liberal Candidate: @theJagmeetSingh you can thank India for cleaning trash people. Ask your gay friend @JustinTrudeau to do the same.
1ir00tx	2025-02	onguardforthee	Liberal leadership hopeful Mark Carney on how he'd change Canada's carbon tax
1iqyfj0	2025-02	onguardforthee	Liberal leadership hopeful Mark Carney says he'd run a deficit to 'invest and grow' Canada's economy
1iqbcox	2025-02	onguardforthee	Second poll projects Liberals win a majority with Mark Carney as party leader
1ioppll	2025-02	onguardforthee	Liberals deny Ruby Dhalla translator for French leadership debate
1inbtwa	2025-02	onguardforthee	Liberals now projected to win a majority with Mark Carney as party leader
1in9qvl	2025-02	onguardforthee	Federal Polling - Mark Carney As Liberal Leader: LPC: 37% (+4) CPC: 37% (+3) NDP: 12% (-6) BQ: 6% (-2) GPC: 5% (+3) PPC: 2% (-3)
1in4ejp	2025-02	onguardforthee	Help me understand, folks
1il6sv3	2025-02	onguardforthee	Liberal Leadership Poll (Alex Kohut) - Carney 54%, Freeland 27%, Gould 7%, Dhalla 4%, Baylis 3%
1ik47dq	2025-02	onguardforthee	Liberals surge ahead of CPC in Quebec and Ontario due to ‘Mark Carney effect’
1ij8paz	2025-02	onguardforthee	"""Helluva Liberal recovery since the last Leger poll on January 26
Liberals up 7, Bloc down 8 and Tories down 1, in a week and a half"""
1ihwjvm	2025-02	onguardforthee	PP's treasonous behaviour is finally paying off for CPC! Liberals are now leading in the weekly Nanos poll with 7 points.
1ig1kcp	2025-02	onguardforthee	Liberal leadership candidates issue joint statement on Trump's tariffs
1iwaarh	2025-02	onguardforthee	Stephen Harper’s Global Alliance of Conservative Parties Quietly Scrubbed India Off Its Website
1iw17dn	2025-02	onguardforthee	Canadian Desis, don't fall for the racism narrative Ruby Dhalla and the conservatives are pushing
1isi199	2025-02	onguardforthee	Leaked guestlist shows oil execs and conservatives from Canada and U.S. gathering at Jordan Peterson's conference
1im9uil	2025-02	onguardforthee	When will Canada’s Conservatives finally stop making excuses for Donald Trump?
1ik6jrt	2025-02	onguardforthee	Donald Trump may just cost Canada’s Conservatives the election
1ik4b0l	2025-02	onguardforthee	Conservatives / MAGA / Maple MAGA playbook
1iis3s3	2025-02	onguardforthee	The Conservatives Have Nothing
1ihhdkv	2025-02	onguardforthee	Bob Rae angers U.S. conservatives after criticizing Trump’s tariffs in Fox News interview
1ivzqvh	2025-02	onguardforthee	Can somebody make Charlie Angus run for leaadership of the NDP
1iqy3ao	2025-02	onguardforthee	Canada National Poll, February 2025 Carney As Leader, LPC: 40% CPC: 37% NDP: 12% BQ: 9% GPC: 2% PPC: 1%
1iq6e4y	2025-02	onguardforthee	Poilievre loves Elon Musk – I don’t. I’m not going to hold back. The NDP plan will hit him where it hurts with a 100% Tariff on Teslas.
1ijem9t	2025-02	onguardforthee	NDP Leader Naheed @naheednenshi.bsky.social calling for Smith's resignation today if the allegations published in the Globe are true about her former Chief of Staff Marshall Smith. Nenshi says either Smith knew &amp; she's complicit or she didn't know and she's incompetent.
1ihv1q6	2025-02	onguardforthee	Ontario Federal Polling: LPC: 43% (+4) CPC: 39% (+4) NDP: 9% (-9) GPC: 4% (+2) PPC: 2% (-4) Others: 3% Mainstreet / Feb 3, 2025 / n=1200 / Online (% Change With 2021 Federal Election)
