id	created_utc	subreddit	title
1brgyxe	2024-03	canada	I’ve been a Liberal for 20 years. My party has lost its way under Justin Trudeau
1bq68ih	2024-03	canada	Tories (41%) Open 18-Point Lead Over Liberals (23%), Lead in Every Region Except Quebec
1bo8xab	2024-03	canada	Opinion: The Liberals broke the immigration system at high speed. They’re repairing it by baby steps
1bh70h4	2024-03	canada	NDP motion to recognize a Palestinian state tests Liberal caucus divisions over Israel-Hamas
1bf0947	2024-03	canada	If the Trudeau Liberals are annihilated in an election, it will be over housing
1bbfoh8	2024-03	canada	338 Sunday Update: Conservatives Open Largest Lead Yet Over Liberals
1bamqh2	2024-03	canada	'This is a red alert': Byelection result has Trudeau Liberals looking nervously toward the next campaign - The Liberals never expected to win, but they never thought they would lose by so much.
1b8ydkp	2024-03	canada	Majority of Canadians not even considering voting for the Liberals: Nanos
1b83o90	2024-03	canada	ArriveCan fallout gives Liberals a 'very black eye,' as public pressure builds on government to resolve mess, say politicos
1b6kgmu	2024-03	canada	Liberal, NDP block proposed examination of national security breaches at Winnipeg infectious-disease facility 
1brfr4e	2024-03	canada	Canada’s ‘Student Trafficking’ Industry Is Backfiring on Trudeau
1bptjtf	2024-03	canada	Trudeau says conservative premiers are lying about carbon pricing
1bozibw	2024-03	canada	Ontario man loses $12K to deepfake scam involving Prime Minister Justin Trudeau
1boosf9	2024-03	canada	LILLEY: Trudeau wastes $42 million on gun 'buy back' that doesn't work; His gun control plan announced four years ago has accomplished nothing anyone can point to.
1bo8g46	2024-03	canada	Andrew Phillips: Miserable young Canadians threaten to make Justin Trudeau feel their pain
1bltvbz	2024-03	canada	Doug Ford has made 'almost no progress' on pledge to build new homes, Trudeau government charges
1bkxhna	2024-03	canada	Jack Mintz: Justin Trudeau's legacy could be a poorer Canada
1bkj0m1	2024-03	canada	Poilievre-led attempt to bring down Trudeau minority over carbon tax fails
1bjekjx	2024-03	canada	Poilievre plans to move non-confidence motion in Trudeau, call for 'carbon tax election'
1bis7rk	2024-03	canada	Trudeau government will stop sending arms to Israel, Foreign Affairs Minister Mélanie Joly says
1bh90ys	2024-03	canada	Pierre Poilievre will undo some of Justin Trudeau's legacy if he becomes prime minister. Here's what he'd target
1bfs6iu	2024-03	canada	Canada's Justin Trudeau says he thinks daily about leaving 'crazy job'
1bfh3vn	2024-03	canada	'No': Trudeau rejects Quebec request for full powers over immigration
1bf1f1j	2024-03	canada	Joe Biden wants to raise corporate taxes and Justin Trudeau should do the same, NDP urges
1be2zp0	2024-03	canada	‘My job is not to be popular,’ Trudeau says after pressed to ditch carbon price hike
1bduy91	2024-03	canada	Peter Menzies: It’s time for Trudeau to stand up to TikTok - Canada should follow America's lead, where a bipartisan anti-TikTok bill is breezing through Congress
1bd98gt	2024-03	canada	Justin Trudeau ally joins Pierre Poilievre to demand a halt to the April 1 carbon levy increase - NFLD and Labrador Premier Andrew Furey says Canadians cannot afford the increase.
1bcw9el	2024-03	canada	Most Canadians want Trudeau government to spend less, poll says
1bc7dxs	2024-03	canada	Trudeau sits idly by as Mexico overtakes us as America's largest trading partner
1bc3sbm	2024-03	canada	Michael Higgins: Affordability fuels Canadian anger — not conspiracy theories - 'It’s the economy, stupid' is a phrase Trudeau would do well to remember
1bas7h7	2024-03	canada	Trudeau’s Orwellian online harms bill
1baobl3	2024-03	canada	P.E.I. premier asks Justin Trudeau to pause upcoming carbon tax hike
1b92qbs	2024-03	canada	Trudeau says some Pro-Palestinian protests cross line into hate, harassment
1b8uy4b	2024-03	canada	Most Canadians think Canada is broken and are angry with Trudeau government: exclusive poll
1b5v5q3	2024-03	canada	Toronto police reviewing pro-Palestinian protest that prompted Trudeau team to scrap event
1b55ckd	2024-03	canada	Pro-Palestinian protesters disrupt Toronto reception Trudeau hosted for Italian PM Meloni
1b3yqty	2024-03	canada	GOLDSTEIN: Trudeau tried to hide massive security failure at Winnipeg biolab - The Trudeau government has an appalling record of failing to stand on guard for the security of Canadians in the face of China's interference with our democracy
1ba1u5g	2024-03	canada	'He's a liar and a hate-monger': Former Progressive Conservative prime minister Kim Campbell slams Pierre Poilievre
1bpx5e1	2024-03	canada	Why Poilievre Will Win; Voters are begging for something, anything different
1bmsyyr	2024-03	canada	Poll: The young and men are much more open to Pierre Poilievre
1bkk6go	2024-03	canada	Poilievre threatens snap election over carbon tax hike, citing inability to maintain constant rage farming until 2025
1bkcb8p	2024-03	canada	Quebec is still the most anti-Pierre Poilievre province in Canada
1bjkk5h	2024-03	canada	Poilievre plans a non-confidence motion on carbon tax
1b8azlr	2024-03	canada	Ukrainians blast Pierre Poilievre's MPs at Toronto townhall meeting: 'You're gonna lose our support'
1b69tcy	2024-03	canada	Earth to millennials: Pierre Poilievre is playing you on housing
1bi4yxk	2024-03	canada	'They're incentivizing terrorism': Canadian relative of Gaza hostage calls NDP's Palestinian motion 'disgusting'
1bkk2uu	2024-03	onguardforthee	Liberals survive non-confidence vote on carbon tax with Bloc, NDP backing
1bi3c7a	2024-03	onguardforthee	Liberals say Poilievre 'doesn't care' about the housing shortage and mock his record | CBC News
1bpc2vl	2024-03	onguardforthee	Conservative premiers are lying about carbon pricing: Trudeau
1bp8y8p	2024-03	onguardforthee	'Renters' Bill of Rights' among new measures in upcoming budget: Trudeau
1bolsjf	2024-03	onguardforthee	Trudeau challenges premiers opposed to carbon tax hike to suggest alternatives to federal levy
1bnj1pp	2024-03	onguardforthee	Trudeau at Toronto Pride, 2006 vs Poilievre with a “straight pride” supporter, 2023
1biucfc	2024-03	onguardforthee	Trudeau government will stop sending arms to Israel, Foreign Affairs Minister Mélanie Joly says
1bf1gqp	2024-03	onguardforthee	Joe Biden wants to raise corporate taxes and Justin Trudeau should do the same, NDP urges
1bdz97k	2024-03	onguardforthee	Trudeau calls out 'short-term thinker' politicians as premiers urge him to freeze carbon price hike 
1b8emd2	2024-03	onguardforthee	"Video: Trudeau Accosted By Protestors While Snow Boarding And Once Again, Somehow, ""Canada Proud"" Has The Video First? Again?"
1b3g2cz	2024-03	onguardforthee	Trudeau showing Mulroney the House of Commons’ virtual voting app, 2023
1bpyrub	2024-03	onguardforthee	Who owns BringItHome.ca?
1blustm	2024-03	onguardforthee	"Pierre Poilievre and the Conservative Party are ""honeydicking"" the country right now, but nobody want's to hear it. I spent less on gas last year than if the carbon tax didn't exist."
1bk9vok	2024-03	onguardforthee	"I just want to put this out there:

In my region, the price of gas went up by 30 cents/litre in a month. From $1.59 in February to $1.89 in March.

Without taxes.

Not a peep from Conservatives.

They wouldn’t dare upset the profits of their corporate overlords."
1bjfi8f	2024-03	onguardforthee	Mulroney-style moderates should ditch the Conservatives
1bh2f3c	2024-03	onguardforthee	“He's a liar and a hate-monger” - Former Conservative Prime Minister, Kim Campbell
1bgfeqw	2024-03	onguardforthee	(Don Bradshaw - NTV) At a Conservative Party of Canada @CPC_HQ event in Corner Brook, NL this evening, handlers for @PierrePoilievre asked the media to leave following his speech; preventing us from posing questions to the party leader.
1b8t7ze	2024-03	onguardforthee	Greenwashing death threats ‘show you who the Conservatives are,’ NDP leader says
1b8i771	2024-03	onguardforthee	The new generation of gay Conservative sellouts
1b3xgkl	2024-03	onguardforthee	Lantsman calls Poilievre’s remarks on trans women ‘the position of the Conservative Party’
1bhpin4	2024-03	onguardforthee	Canada's NDP motion calls for recognition of Palestinian state
1bczqoh	2024-03	onguardforthee	Graham Thomson: 'They are immoral and they are dangerous': Naheed Nenshi comes out swinging at Danielle Smith and UCP in bid for Alberta NDP leadership
1bcb2fu	2024-03	onguardforthee	Former Calgary mayor Naheed Nenshi announces bid for Alberta NDP leadership | CBC News
1cbu60m	2024-04	canada	Poll suggests half of Canadians have negative opinion of latest Liberal budget
1cb9clf	2024-04	canada	Poilievre’s Conservatives reach highest-ever lead over Trudeau’s Liberals, according to new poll
1cb3uye	2024-04	canada	Opinion: The Liberal’s immigration policies have accomplished the opposite of what was intended
1c9hjly	2024-04	canada	Why Justin Trudeau's Liberals are introducing 'halal mortgages'; Feds eyeing 'alternative financing products,' but critics charge measure is a 'desperate ploy' for votes
1c7i5x0	2024-04	canada	Wealthy Canadians demand the Liberals also raise taxes on the capital gains of the poor
1c723u1	2024-04	canada	Recent immigrants think Canada's immigration targets are too high, prefer Tories to Liberals: poll
1c6i50c	2024-04	canada	Liberal budget promises 10 bajillion dollars to whatever thing you’re into
1c68q4l	2024-04	canada	Liberals must now sell a budget they say will help younger Canadians catch up
1c4pn0c	2024-04	canada	Jagmeet Singh says the Liberals and Conservatives are ‘controlled’ by corporate lobbyists. How true is that?
1bzr35y	2024-04	canada	'The costs have ballooned': Liberal government failed to anticipate difficulty of gun 'buyback,' association says
1busb1m	2024-04	canada	Han Dong says international students voted en masse in his 2019 Liberal nomination
1byfdg8	2024-04	canada	Why the Conservatives and NDP are headed for a clash over Canada's working-class votes
1by7lso	2024-04	canada	Conservative Party reacts to Alex Jones' endorsement of Pierre Poilievre
1bvov29	2024-04	canada	Young voters aren’t buying whatever Trudeau is selling; Many voters who are leaning Conservative have never voted for anyone besides Trudeau and they are desperate to do so, even if there is no tangible evidence that Conservative leader Pierre Poilievre will alter their fortunes.
1c5kk8e	2024-04	canada	The carbon tax is almost dead, and NDP leaders are helping to kill it
1c2fji9	2024-04	canada	Trudeau says he doesn't understand why NDP is pulling back from carbon price support
1c7jjmu	2024-04	onguardforthee	Wealthy Canadians demand the Liberals also raise taxes on the capital gains of the poor
1c6ly5s	2024-04	onguardforthee	WATCH: Pierre Poilievre has his ass handed to him during Question Period by Liberal Minister Sean Fraser - Crier Media
1cg8jt1	2024-04	onguardforthee	"As Conservatives try to block Pharmacare – records show that Pierre Poilievre's second-in-command, Melissa Lantsman – is a former Lobbyist for Big Pharma.

Here is one of the horrifying practices of the company she worked for: 

They raised a drug used to treat cancer, by 82%. "
1cdrwlt	2024-04	onguardforthee	Everything freedom loving Conservatives have banned Canadians from doing in recent years
1c9ysw6	2024-04	onguardforthee	CONservative Experience
1c998io	2024-04	onguardforthee	Conservative Voters when a tax increase is proposed
1c8nqbh	2024-04	onguardforthee	Today's conservatives not fit to lead in an emergency
1c4acq3	2024-04	onguardforthee	Pierre Poilievre Is a Symptom of the Conservatives’ Sickness | The Tyee
1c3y2w4	2024-04	onguardforthee	"Conservative immigration critic on Conservative immigration plan: ""If it’s lower, it’s lower. If it’s higher, it’s higher.” Tom Kmiec admitted to True North that a Conservative government may increase immigration levels."
1byl3ap	2024-04	onguardforthee	SaskParty (Conservative) MLA Nominee Candidate, MS Gill, caught giving bribe to voter.
1by7lbn	2024-04	onguardforthee	Conservative Party reacts to Alex Jones' endorsement of Pierre Poilievre
1bxquq7	2024-04	onguardforthee	A non-conservative friend of mine says they try and avoid talking about politics with people in the car scene in Canada because a lot of them have bad takes, they sent me this from the World of Wheels car show in Calgary this weekend
1bxjon8	2024-04	onguardforthee	Former Leader of Canada's Conservatives Accuses His Own Party Of Working With Chinese Communist Party To Interfere In Canadian Elections
1bwqjgq	2024-04	onguardforthee	"Alex Jones is a despicable human being who will say anything, do anything to stir dissent and hatred.
But he does have a good eye for those of like mind.
Is Poilievre going to disavow this hate monger?
This is the face of Canada's Conservative party in 2024."
1btjbac	2024-04	onguardforthee	"Here is a Conservative opponent to carbon pricing explaining that they are in fact better off with carbon pricing in place as a result of the Canada Carbon Rebate they receive.

Take a watch to hear from the Premier of Alberta!"
1cbaufr	2024-04	onguardforthee	Ford government House Leader Paul Calandra  just got up in the Legislature over the Keffiyeh ban and really said “I don’t need to take lessons from the Ontario NDP on marginalized people. I’m ITALIAN!”
1c2fa5s	2024-04	onguardforthee	Trudeau says he doesn't understand why NDP is pulling back from carbon price support
1d3btu0	2024-05	canada	"The Trudeau Liberals have eroded all five pillars of prosperity

Economics says the pillars are: spending restraint, low taxes, minimal regulation, sound money, free trade. Ottawa is oh-for-five"
1d13j3y	2024-05	canada	Conservatives, Bloc Québécois force meeting to investigate Liberals’ refusal to share foreign interference documents with public inquiry
1d130ev	2024-05	canada	LILLEY: Trudeau Liberals making moves to cheapen Canadian citizenship; Liberals looking to extend citizenship to grandchildren and illegals.
1cy98rw	2024-05	canada	Homelessness increased by 20 per cent despite $443 million Liberal plan: PBO 
1cxm3we	2024-05	canada	Tasha Kheiriddin: Liberals stuck in vicious cycle of rising immigration and housing shortages; Permanent residents rise, while housing starts fall
1cnalxm	2024-05	canada	NDP leader slams Liberals for giving nearly $26-million to Costco, Loblaw in recent years
1cmakjh	2024-05	canada	Singh tells Conservatives to back off as House prepares for first pharmacare vote
1chrnfg	2024-05	canada	House of Commons Speaker won’t step down amid renewed Conservative calls for his resignation
1cxqocp	2024-05	canada	Grocery chains should face an extra tax when profits soar, NDP says
1cv0pij	2024-05	canada	NDP to force vote on its call for excess profit tax on big grocers - “[D]ue to your failure, Canadians are paying high prices and they’ve had to take matters into their own hands by boycotting big grocery chains,” Singh wrote in a letter to Trudeau and Poilievre.
1d3mt4a	2024-05	onguardforthee	Poilievre says Canadians 'fleeing' to Nicaragua, Liberals say it shows he 'doesn't have a clue'
1cv7hfh	2024-05	onguardforthee	"Conservative MP on accidentally buying vegan ice cream: ""Vote for the NDP-Liberal Trudeau government coalition if you want to eat stealthy plants and bugs."""
1cny2fj	2024-05	onguardforthee	NDP leader slams Liberals for giving nearly $26M to Costco, Loblaw for energy-efficient appliances
1ckcnmy	2024-05	onguardforthee	Calling on YOU, reader, to protect yourself and your rights.
1d3niuq	2024-05	onguardforthee	Conservative Leader Pierre Poilievre's housing plan defeated in House of Commons
1d2wrp4	2024-05	onguardforthee	The Canadian Dental Care Plan means more than two million seniors — who didn’t have coverage — can finally go to the dentist. This program is already changing lives, and Conservative MPs are still trying to cut it.
1d2i0g4	2024-05	onguardforthee	Conservatives stall Indigenous clean water law, minister says
1d1carf	2024-05	onguardforthee	Conservatives - Nothing for you!
1d0pzgx	2024-05	onguardforthee	At the height of hypocrisy this week, Conservatives cite the surge in people using food banks, while opposing a $1B investment in Budget 2024 to feed 400,000 kids across Canada! BTW - They have opposed every measure or support that lift vulnerable people up.
1cy6wwa	2024-05	onguardforthee	The Conservative candidate just won the recent Milton, Ontario  by-election with a pitiful 12,880 votes because more than 70,000 people didn’t bother to show up.
1cw10n5	2024-05	onguardforthee	“Anti-Canadian sentiment is strong among those who favour Pierre Poilievre and the Conservative Party of Canada”
1ctq5t9	2024-05	onguardforthee	Justin Trudeau says Canada’s conservative leaders threaten abortion rights
1cs4g83	2024-05	onguardforthee	German high court rules that German intelligence is justified in classifying the Conservative Party-linked far-right AfD party as a suspected extremist organization. This is the party that CPC MPs wined &amp; dined, &amp; faced no punishment by their leader.
1cp8yg0	2024-05	onguardforthee	Chrystia Freeland says Conservatives ‘hang out with white supremacists’ | QUESTION PERIOD
1coz1ab	2024-05	onguardforthee	Speaking for ALL Conservatives, MP Cathay Wagantall states the Conservative Party of Canada believes that abortion should be outlawed from the instant of conception: “And we in the House, as Conservatives, stand for equality between men and women from the instant of conception.”
1co6s8a	2024-05	onguardforthee	Today I moved a motion to reaffirm a woman’s right to reproductive health care and what did the Conservatives do? They shut down the meeting. (1/2)
1co2tub	2024-05	onguardforthee	"I’m headed to a counter-protest in Ottawa right now.

I'll be marching to defend a woman’s right to choose.

Sadly, Pierre Poilievre’s Conservative MPs will be on the opposing side – attacking these rights and demanding they be taken away from women and Canadians."
1cmlusu	2024-05	onguardforthee	"Last week, Pierre Poilievre threatened to override the fundamental rights &amp; freedoms of Canadians.

Today, we saw Pierre's Conservative MP follow in his leader's footsteps &amp; attack the Morgantaler decision - the Supreme Court ruling that decriminalized abortion in Canada."
1clsyms	2024-05	onguardforthee	NDP calls out Conservatives for effort to quash pharmacare legislation
1ckoe0a	2024-05	onguardforthee	Pierre Poilievre doesn’t have anything nice to say. The Conservative leader is toxic and it’s infecting public discourse
1drdj3m	2024-06	canada	Liberal MP Chahal among nine MPs demanding ‘immediate’ caucus meeting to discuss ‘extremely concerning’ byelection loss
1dqt52n	2024-06	canada	Did Justin Trudeau cover up the Chinese spy scandal? - The Liberal Party has failed to protect Canada
1dqi3yc	2024-06	canada	Justin Trudeau has to step down, former B.C. premier Christy Clark says: ‘I want the Liberal party that I used to vote for to come back’
1dq1nl6	2024-06	canada	Some Liberal insiders worry they’re seen as too ‘woke’ under Justin Trudeau — and that it may be too late for him to go
1dp9l0k	2024-06	canada	'A lot of people have made up their minds against Trudeau,' Thunder Bay Liberal MP says
1dp40h1	2024-06	canada	Immigration Minister calls for ‘introspection’ after Liberal by-election defeat but says Trudeau should remain leader
1doxxji	2024-06	canada	Don Braid: Liberal defeat is now possible in every single riding across Canada
1doxwn6	2024-06	canada	Most Gen Z, millennials don't think Liberals will fix 'rigged' system: poll
1do9oaj	2024-06	canada	Liberals grapple with stunning Toronto byelection loss and Justin Trudeau’s future: ‘The pressure will mount for sure’
1do1feo	2024-06	canada	Conservatives win longtime Liberal stronghold Toronto-St. Paul in shock byelection result
1dnl2i0	2024-06	canada	Even Justin Trudeau’s resignation might not save the Liberal party, new poll suggests - Canadians are growing frustrated with Prime Minister Justin Trudeau — but his successors may not fare much better, according to the Angus Reid Institute survey.
1dmt4l7	2024-06	canada	"The Liberals are hustling to stop a 'seismic shift' in one of their safest seats
 - There has been speculation that Trudeau will come under pressure to resign if the party loses in Toronto—St. Paul's but no MP or minister has said that publicly"
1dmn55r	2024-06	canada	Dental groups reject Liberal claim that Conservatives are fuelling opposition to new plan — instead claiming it’s Ottawa spreading misinformation
1dknenq	2024-06	canada	Justin Trudeau’s Liberals head into summer with lowest share of committed voters since they were elected in 2015 - The Liberals trail the Conservatives in all age groups, with men and women, and in all provinces but Québec.
1dg3tuf	2024-06	canada	NDP leader says Han Dong shouldn't be allowed back into Liberal caucus
1dfy8p1	2024-06	canada	Singh won't break pact with Liberals despite concern PM isn't protecting democracy
1dez49l	2024-06	canada	Liberals haven't prioritized productivity during nearly nine years in power: David Dodge
1ddp54i	2024-06	canada	Poilievre comes out against capital gains tax change, Liberal plan passes with backing of other parties
1ddl949	2024-06	canada	Conservatives to vote against Liberal capital gains plan
1dcksls	2024-06	canada	‘No hope’ for Liberals winning next federal election with Trudeau as leader, say pollsters
1dbvaah	2024-06	canada	Canadians have been told there might be traitors in Parliament. Why aren’t the Liberals and Conservatives running around like their heads are on fire?
1daeomr	2024-06	canada	Liberals refuse to say if current Cabinet ministers named in foreign interference report
1da8smr	2024-06	canada	'Shocking,' 'abusive': Liberals blasted for blocking over 1,000 documents from foreign interference committee
1d9rjct	2024-06	canada	Canadians 3 times more likely to prefer someone other than Trudeau lead Liberals in next election
1d9jxm3	2024-06	canada	Liberals will not release names of parliamentarians accused of collaborating with hostile foreign states
1d9ijt0	2024-06	canada	Matthew Lau: Pretty much everything the Liberals do makes us poorer; GDP growth is sluggish and we have high taxes, an expanding public sector and federal hostility to business to thank for that
1d90358	2024-06	canada	Opposition asks Liberals to name parliamentarians colluding with foreign powers
1d7yfc1	2024-06	canada	More and more people are discovering they are 'rich' in the eyes of Liberals
1d5xlxh	2024-06	canada	Liberals face pushback over election delay pension proposal | CTV News
1d7a3cu	2024-06	canada	Pierre Poilievre disagrees with Conservative MP who wants to vote against same-sex marriage | CBC News
1dqn1bm	2024-06	canada	Jagmeet Singh says Toronto byelection shows voters are 'done with Trudeau,' doesn't address NDP drop
1dm5icr	2024-06	canada	Naheed Nenshi elected new leader of the Alberta NDP. Former Calgary mayor garners nearly 86 per cent of votes.
1df8gyl	2024-06	canada	NDP’s Jagmeet Singh says report shows ‘a number of MPs’ have helped foreign states
1deva3o	2024-06	canada	NDP MP rarely on Parliament Hill billed taxpayers for travel with family over Christmas
1ddd0u8	2024-06	canada	Politics Briefing: Singh pledges to eject NDP members if they colluded with foreign governments
1db5pse	2024-06	canada	Douglas Todd: Jagmeet Singh wins the Muslim vote, but loses most everyone else - Opinion: The NDP leader is failing badly with fellow Sikhs, other South Asians, Christians and especially Jews and Hindus.
1do1fu9	2024-06	onguardforthee	Conservatives win longtime Liberal stronghold Toronto-St. Paul's in shock byelection result
1d9jh0z	2024-06	onguardforthee	NDP motion to lower grocery prices for Canadians rejected by Liberals and Conservatives
1d9hj2i	2024-06	onguardforthee	Trudeau said that changing to ranked choice wasn't in the Liberals best interest, post-election. Now they're tanking in the polls - could we yet get ranked choice?
1d8zr1w	2024-06	onguardforthee	Pierre Poilievre's Conservatives say they would vote gay marriage down. Our Liberal team won't let that happen.
1dlkizq	2024-06	onguardforthee	As physicians we should be very concerned about the Federal Conservatives threatening to “revoke” the medical license of a doctor who disagrees with their ideology and speaks against them
1dfv6bj	2024-06	onguardforthee	The NDP has written to the Minister of Public Safety to include the Conservative leadership races in the foreign interference inquiry. China and India have been named as allegedly interfering in the leadership races. Who did they help? Allegations like this cannot be left unaddressed.
1dcx3pn	2024-06	onguardforthee	"[Video] Jagmeet Singh demands inquiry on all fronts: ""The NSICOP report indicates that there are MPs who knowingly worked with foreign governments to undermine Canada... The idea that a foreign government was involved in the selection of the leader of the Conservative Party is deeply concerning"""
1d83lxb	2024-06	onguardforthee	A good day for Canadians, indeed! Under the NDP Pharmacare Plan: 9 million Canadians will get access to free birth control 3.7 million Canadians will receive free diabetes medications Pierre Poilievre tried to block it and Conservatives will try to cut and gut it - we won't let them.
1d5hfgc	2024-06	onguardforthee	For Pride Month 2024, Let's Remember the Danger Pierre Poilievre and his Conservatives Pose for LGBTQ+ Rights.
1dj6lmj	2024-06	onguardforthee	Alberta doctors labelled ‘pedophiles, sex offenders’ at UCP fundraising event, NDP say
1dfezpv	2024-06	onguardforthee	Poilievre ‘deeply irresponsible’ for not reading foreign interference report: NDP leader
