id	created_utc	subreddit	title
1dfdlbu	2024-06	onguardforthee	NDP leader says he's more alarmed after reading unredacted intelligence report
1dd4sq9	2024-06	onguardforthee	Politics Briefing: Singh pledges to eject NDP members if they colluded with foreign governments
1e4u0cy	2024-07	canada	Trudeau assures Liberals they just need to ride out this 28 month polling dip
1dxwrsr	2024-07	canada	Liberal Party watches in horror as French centrists fail to turn fear of right-wing maniacs into unending political power for themselves
1dwq6e5	2024-07	canada	The NDP has failed to gain from Liberal losses
1du019s	2024-07	canada	Trudeau no longer going to Calgary Stampede, as some Liberal MPs call for his resignation or at least a meeting
1e39uv4	2024-07	canada	Poilievre's comments a setback to efforts to reopen Sudbury's drug consumption site - Conservative leader calls them 'drug dens' and says 'radical bureaucrats don’t have the right to open (them) anywhere they want'
1e1kbqa	2024-07	canada	Conservatives would close supervised drug consumption sites near schools, playgrounds: Poilievre
1dxx1xg	2024-07	canada	Conservative supporters show higher susceptibility to Russian disinformation: survey
1eefpk3	2024-07	canada	338Canada: CPC: 212, LPC: 73, BQ: 38, NDP: 18, GPC: 2, PPC: 0.
1dtkkvy	2024-07	canada	Even NDP voters aren't crazy about Jagmeet Singh propping up Trudeau: poll
1dtbjw7	2024-07	canada	NDP MP pays back some of the $17,000 her Christmas trip cost taxpayers
1eew8jk	2024-07	onguardforthee	Harris breathes new life into Democratic Party. Could someone do the same for Canada’s Liberals?
1e9l6qx	2024-07	onguardforthee	Liberals launch an interactive website where users can vote on the worst parts of Poilievre's record
1ed53xk	2024-07	onguardforthee	Everything freedom loving Conservatives have banned Canadians from doing in recent years
1e9vduy	2024-07	onguardforthee	This is what a Conservative Party fundraising email looks like
1e493jw	2024-07	onguardforthee	What Is Wrong with Canada’s Conservatives?
1e29p9p	2024-07	onguardforthee	Poilievre Pulverized: Viral Clip Shows Conservative Leader Eviscerated at First Nations Conference Before Literally Running Out A Back Door With Security.
1e0t7v0	2024-07	onguardforthee	The scene as Conservative Leader Pierre Poilievre makes his first in-person speech at the Assembly of First Nations. Some veterans and delegates quietly turn their back as he tries to reset the relationship with the AFN.
1e0bqql	2024-07	onguardforthee	"Conservative Leader refers to newly opened Halifax encampments as ""Trudeau Towns"""
1dxvudd	2024-07	onguardforthee	Conservative supporters show higher susceptibility to Russian disinformation: survey
1dwnu1n	2024-07	onguardforthee	Serious allegations, but no apparent desire for solutions: Why does Conservative Leader Pierre Poilievre refuse to obtain the security clearance required to read the unredacted version of the “Special Report on Foreign Interference in Canada’s Democratic Process and Institutions”?
1dtx2l7	2024-07	onguardforthee	‘People should be afraid’: Pierre Poilievre’s Conservatives have been targeting experts. Is this just the beginning?
1f4bvgi	2024-08	canada	Poilievre says he would cut population growth after Liberals signal immigration changes coming
1f427cm	2024-08	canada	Poilievre asks Singh to pull support for Liberal government to prompt fall election
1f2h1jd	2024-08	canada	Trudeau says he plans to lead Liberals into next federal election, dismisses comparisons to Biden
1f2g1h3	2024-08	canada	Many gaps remain in the Liberals' new restrictions on temporary foreign workers
1f178ya	2024-08	canada	Liberals say they will rein in temporary foreign worker program after historic influx
1exu0ek	2024-08	canada	Liberals go hog wild on immigration, hoping to secure victory in 2029 and beyond
1ewe2gq	2024-08	canada	Tories delete Canadian dream video featuring what Liberals say are Russian jets
1ew7sz4	2024-08	canada	Liberal Party pulls out of Capital Pride parade over pro-Palestinian statement
1euieq4	2024-08	canada	"NP View: Canada's immigration systems needs to be rescued from Trudeau; 
It took a government as incompetent as the Liberals to allow numbers to spiral beyond our short-term capacity"
1esvlaq	2024-08	canada	"LILLEY: Trudeau changed foreign workers program at your expense; 
More than two years ago, the Trudeau Liberals opened up the Temporary Foreign Workers Program in a way that is hurting Canadian workers and their wages."
1escnfb	2024-08	canada	The folly of Liberal immigration policy is now showing up in the job market
1es9e9h	2024-08	canada	Liberal government refuses to say if it approved bonus for CBC CEO Catherine Tait
1es1iy4	2024-08	canada	The Liberals are using foreign workers to suppress wages for their political benefactors
1encnzc	2024-08	canada	Tasha Kheiriddin: Liberal immigration policy risks turning Canada into terrorist haven
1elfws0	2024-08	canada	Sharp contrast: Poilievre 'can't wait' to defund CBC, but that's 'recklessly threatening' Canadians' access to reliable information, say Liberals
1ejzsgx	2024-08	canada	Liberals borrow 'weird' tactic from Democrats in latest attack on Pierre Poilievre
1f45y8m	2024-08	canada	Canada’s Conservatives are crushing Justin Trudeau - Pierre Poilievre is even winning over the young and the unionised
1exxxhf	2024-08	canada	Conservative Party Experiences Largest Decline Since Pierre Poilievre Assumed Leadership
1ex48cs	2024-08	canada	Backlash as Canada conservatives’ ‘our home’ video features other countries
1ew5qyw	2024-08	canada	Conservatives promise that, if they're elected, your parents will reunite, your fav tv show will be uncancelled and Mcdonald's will bring back pizza
1eln6jh	2024-08	canada	Conservatives demand government explain how terror suspects immigrated to Canada
1ej3fcm	2024-08	canada	Conservatives lie like they breathe,' says Yves-François Blanchet 
1f0kzly	2024-08	canada	LILLEY: Jagmeet Singh's NDP lose all credibility backing Trudeau; The NDP leader has become the boy who cried wolf with his ongoing complaints but constant support of the Trudeau government.
1ekm5ur	2024-08	canada	'Crisis point:' NDP asks Trudeau to step up amid Toronto's refugee housing crisis
1ez1m35	2024-08	onguardforthee	Conservative propaganda at work on YouTube, home equity is already tax free and Liberals have not proposed such a tax
1eyug40	2024-08	onguardforthee	Instead of bargaining today, CN and CPKC chose to lock out 9300 workers, hurting thousands of families and Canada’s economy. Too often, the Liberals and Conservatives have rewarded corporate giants like CPKC and CN for locking out workers - fueling their greed. Workers and Canadians deserve better
1ewvfx5	2024-08	onguardforthee	Tories delete Canadian dream video featuring what Liberals say are Russian jets
1el9haj	2024-08	onguardforthee	Sharp contrast: Poilievre ‘can’t wait’ to defund CBC, but that’s ‘recklessly threatening’ Canadians’ access to reliable information, say Liberals
1ek17jx	2024-08	onguardforthee	Liberals borrow ‘weird’ tactic from Democrats in latest attack on Pierre Poilievre
1f2okys	2024-08	onguardforthee	Conservatives want Trudeau to step down because they’re scared
1f1xf6i	2024-08	onguardforthee	By slamming experts, Pierre Poilievre and his staff are degrading political debate
1f19v98	2024-08	onguardforthee	Ron DeSantis appointed board trustee and friend of project 2025 coming to Red Deer, hosted by Canada strong and Free Network. Sponsored by Meta. 
1ezprep	2024-08	onguardforthee	Canada’s Conservative Party removes patriotic video mistakenly showing Russian fighter jets | CNN
1ezp9bh	2024-08	onguardforthee	Federal Conservative Leader Pierre Poilievre's attempt to re-label Nazism only serves to benefit Nazism. 
1ey0q5e	2024-08	onguardforthee	Conservative Party Experiences Largest Decline Since Pierre Poilievre Assumed Leadership
1exafv2	2024-08	onguardforthee	Backlash as Canada conservatives’ ‘our home’ video features other countries
1ew6dyw	2024-08	onguardforthee	Conservatives promise that, if they're elected, your parents will reunite, your fav tv show will be uncancelled and Mcdonald's will bring back pizza
1evppmw	2024-08	onguardforthee	The Conservative Party HQ page has just deleted their video that featured Soviet jets, and stock footage from America, Europe, and other countries, which was being misrepresented as Canadian.
1erpwyz	2024-08	onguardforthee	A former Progressive Conservative who calls Pierre Poilievre ‘terrifying’ is launching a new political party
1erlsts	2024-08	onguardforthee	Pierre Poilievre was reportedly reluctant to congratulate Canada’s amazing athletes for their historic performance at #Paris2024 because his campaign felt it went against his ‘Canada is broken’ narrative. He only did so after being called out by the media. The Conservatives’ politicization
1el0siy	2024-08	onguardforthee	This is what an email from Pierre Poilievre’s Conservative Party looks like
1ehhqnp	2024-08	onguardforthee	[Gilmore] Conservative Party fundraising emails are now telling Canadians to “fight for freedom” because their political opponents are on a “WAR PATH”
1eh6hnm	2024-08	onguardforthee	'Conservatives lie like they breathe,' says Yves-François Blanchet
1f30cv1	2024-08	onguardforthee	Alberta NDP Leader Naheed Nenshi slams premier's plan to transfer hospitals
1ev855k	2024-08	onguardforthee	Cringelord Pierre Polievere threatens to sue NDP 😂
1epsswa	2024-08	onguardforthee	NDP calls for an investigation into bot posts about Poilievre rally
1frgfnl	2024-09	canada	CSIS agents frustrated by delay for electronic warrant against long-time Liberal politician
1fr0j9n	2024-09	canada	Braid: Liberal party that refuses to dump Trudeau is heading for the scrap heap
1fqqv6p	2024-09	canada	Majority of all Canadians now disapprove of Trudeau — except hardcore Liberals: poll [Leger Poll: Conservatives 44%, Liberals 24%, NDP 17%, Bloc Quebecois 7% (32% in QC), Green 5%]
1fpwlpa	2024-09	canada	I’ve voted Liberal my entire life. Trudeau has made that impossible now.
1fn81nq	2024-09	canada	'People just don't like us anymore': Quebec is turning on Trudeau's Liberals
1fm67w9	2024-09	canada	Conservatives call on Elon Musk to step in after Liberals provide loan to Ottawa-based satellite operator
1fkrw9o	2024-09	canada	Jagmeet Singh says NDP will back Liberals in non-confidence vote
1fi0dno	2024-09	canada	Jamie Sarkonak: Don't burden the rest of Canada with asylum seekers. Change the rules; Liberal loopholes have brought too many want-to-be refugees to the country, but Alberta, B.C., New Brunswick and Nova Scotia are at capacity
1fhjetn	2024-09	canada	Liberal minister dismisses Elon Musk's satellite offer to Canada as 'nonsense'
1fgmoyg	2024-09	canada	LILLEY: Trudeau has broken every aspect of our immigration system; System is falling apart due to mismanagement by Trudeau's Liberal team.
1fg845p	2024-09	canada	‘I’m not going anywhere’: Justin Trudeau says he won’t resign if Liberals lose Montreal byelection
1fdmrsm	2024-09	canada	Nearly half of Canadians want federal election after NDP-Liberal agreement ends, poll suggests
1fcxa7y	2024-09	canada	Liberal MP says her constituents are 'very adamant' Justin Trudeau needs to go
1fcrlss	2024-09	canada	‘He’s not getting the message’: Justin Trudeau shrugs off the naysayers as he heads into a Liberal caucus retreat
1f8y88r	2024-09	canada	NDP announces it will tear up governance agreement with Liberals
1fq1uug	2024-09	canada	After 1st failed attempt, Conservatives table another non-confidence motion - National | Globalnews.ca
1foe2we	2024-09	canada	Conservatives table non-confidence motion to try to topple Trudeau
1fjor30	2024-09	canada	Conservatives are targeting Singh over his pension — but Poilievre's is three times larger | CBC News
1fjhley	2024-09	canada	China tried to drive voters away from Conservative candidate, inquiry hears
1fhf3pe	2024-09	canada	Conservative deputy leader says Canadian ‘consensus’ immigration is under strain
1fgxa4l	2024-09	canada	Andrew Scheer avoids answering if Conservatives will cancel dental care program
1ff57yh	2024-09	canada	BC Conservatives announce involuntary treatment for those with substance use disorders
1fd2v65	2024-09	canada	NDP candidate’s leaflet featuring Palestinian flag draws criticism from Conservatives
1fc8498	2024-09	canada	Conservatives call on government to disclose how latest ISIS suspect came to Canada
1ff46wp	2024-09	canada	Singh signals NDP plan to oppose carbon tax, says it puts burden on ‘backs of working people’
1fad7cj	2024-09	canada	NDP used stock video from Russia, weeks after decrying Tories for doing the same
1fkru0j	2024-09	onguardforthee	Jagmeet Singh says NDP will back Liberals in non-confidence vote
1fi9vif	2024-09	onguardforthee	Liberal House leader calls Poilievre a 'fraudster' and a 'bully' as Commons returns | CBC News
1fhirp8	2024-09	onguardforthee	Liberal minister dismisses Elon Musk's satellite offer to Canada as 'nonsense'
1ffgd9q	2024-09	onguardforthee	Pierre Poilievre’s nickname for Jagmeet Singh is ‘racist,’ Liberal minister charges
1f8y9nw	2024-09	onguardforthee	NDP announces it will tear up governance agreement with Liberals
1frzk0y	2024-09	onguardforthee	It’s time for a different kind of common sense — one that’s rooted in solidarity and focused on the common good: Decades of austerity and social service cuts, driven by Conservative politicians, have devastated working people
1frvw0w	2024-09	onguardforthee	Conservative cultist
1fq0czw	2024-09	onguardforthee	After 1st failed attempt, Conservatives table another non-confidence motion - National | Globalnews.ca
1fpfb8x	2024-09	onguardforthee	Trudeau accuses Conservatives of 'casual homophobic comments' in question period
1fn8d5y	2024-09	onguardforthee	CONservatives: conning accountability
1fn6xxx	2024-09	onguardforthee	Poilievre’s Dangerous Dance with MAGA-Style Politics - By being responsive to die-hard conservatives, he puts himself at their mercy - By Justin Ling
1fmuhia	2024-09	onguardforthee	Just 1 in 3 Canadians are hopeful about a potential Conservative government under Pierre Poilievre
1fmkv2o	2024-09	onguardforthee	Elizabeth May discusses foreign interference by China and India in the Conservative Party’s leadership race. And she urges Pierre Poilievre to get his Top Secret security clearance, stating it should be mandatory for party leaders to do so.
1fme0dg	2024-09	onguardforthee	CONservative strategy
1flxwwo	2024-09	onguardforthee	Canadian Conservatives Propose Bill for Online Digital ID Verification and Anonymity Restrictions
1fkwcb5	2024-09	onguardforthee	Canadians don’t believe a Conservative government would balance the budget or lower taxes
1fk7lyj	2024-09	onguardforthee	O'Toole says he considered expelling a Conservative senator over foreign influence concerns
1fjzpfz	2024-09	onguardforthee	[Rosemary Barton] BQ leader Yves Francois Blanchet says he will not support Conservative non-confidence motion next week. So that's one chance of an election averted.
1fjpsw0	2024-09	onguardforthee	Conservatives are targeting Singh over his pension — but Poilievre's is three times larger
1fijued	2024-09	onguardforthee	Poilievre's poor favourability will cost the Conservatives come election time
1fgvqmv	2024-09	onguardforthee	Will Conservatives roll back dental care if elected? House Leader Scheer won't say
1fdro8b	2024-09	onguardforthee	The Conservative Party leader brags about cutting the Canadian Dental Care Plan: A plan that’s allowed 650,000 people — and counting — to finally get their cavities filled, a toothache treated, or their dentures replaced. And the Conservative Party leader wants to cut it.
1f9sk36	2024-09	onguardforthee	Conservative Leader Pierre Poilievre and two of his predecessors all follow Lauren Chen, who was just linked to a Russian influence operation.
1f8xhsq	2024-09	onguardforthee	Don't be fooled, Conservatives are no friend to workers
1f89m1i	2024-09	onguardforthee	Pierre Poilievre's Conservatives now calling for arrest of their perceived political opponents - Crier Media
1f6d9w1	2024-09	onguardforthee	Conservatives love labour day now!
1fnwv1b	2024-09	onguardforthee	NDP urges government to recognize Palestinian statehood, sanction Israeli officials
1fl1718	2024-09	onguardforthee	Jagmeet Singh, NDP targeted by misinformation attacks, foreign interference inquiry hears. NDP's national director says she fears online attacks will lead to real-life violence 
1gaevkf	2024-10	canada	Liberals set to announce immigration system changes, sources say
1g9f6ho	2024-10	canada	Trudeau resignation would be in Canada’s best interest: Liberal MP
1g949h8	2024-10	canada	New Brunswick Liberals will form next majority government, CBC News projects
1g5h1jb	2024-10	canada	Liberal MPs will present official demand for Trudeau to resign in coming days, sources say
1g3nk4p	2024-10	canada	Justin Trudeau is killing Canada’s liberal dream
1g2rsue	2024-10	canada	‘Enough is enough’: nervous Liberal MPs push for Trudeau's exit before the next election
1g1o4rt	2024-10	canada	Some Liberal MPs are mounting a new effort to oust Justin Trudeau | CBC News
1g0vdzi	2024-10	canada	Senate passes Liberal, NDP bill to cover diabetes and birth control medication
1g0j1d2	2024-10	canada	Liberals’ refusal, opposition’s demands over documents for spending scandal has created a government backlog
1fz2saz	2024-10	canada	Chris Selley: Justin Trudeau's electoral-reform mea culpa only makes him look worse - We all knew the Liberals shamelessly deceived proportional representation supporters. It's still remarkable to hear him admit it
1fysncx	2024-10	canada	Poilievre blames Liberals for rising antisemitism in remarks at Oct. 7 commemoration ceremony. 
1fwajau	2024-10	canada	‘All bets are off’ for how far the Liberals will slide in the polls: Nanos
1fvroaz	2024-10	canada	Parliament 'ground to a halt' over Conservative allegations of Liberal corruption
1fux9to	2024-10	canada	Liberals change rules so more Canadians can buy the shittiest condos ever built
1ftyjam	2024-10	canada	Conservatives' second attempt to topple Liberal government fails
1gc7i7z	2024-10	canada	B.C. Conservative candidate uses racist slur to describe Indigenous Peoples on election night
1gb1dg4	2024-10	canada	Trudeau suggests Conservative Leader has something to hide by refusing a national security clearance
1g7csxb	2024-10	canada	B.C. Conservatives plan $11B deficit in first year, higher than NDP or Greens
1g5ci6g	2024-10	canada	Poilievre demands names after Trudeau claims Conservatives compromised by foreign interference
1g53cag	2024-10	canada	Trudeau tells inquiry some Conservative parliamentarians are involved in foreign interference
1g224j6	2024-10	canada	‘Not surprising’ Trudeau regrets breaking electoral reform pledge as Conservatives soar, says Fair Vote Canada
1fwuwfj	2024-10	canada	Parliament at a standstill as Conservative MPs push for release of green-tech fund papers
1ftzm8m	2024-10	canada	Poll: Only Canadians still planning to vote for Trudeau are Conservative Premiers who get to blame him for all their failures
1gee40a	2024-10	canada	[CBC] B.C. NDP hangs on to power, will form next government CBC projects
1gdshyw	2024-10	canada	B.C. election results: Mail-in ballots heavily favour NDP, only absentee ballots left to count
1gdbs4g	2024-10	canada	SK NDP Leads Saskatchewan Party, 49% to 46%
1gd26ep	2024-10	canada	NDP widens lead but B.C. election remains too close to call
1g949rt	2024-10	onguardforthee	CTV News projects N.B. Liberals will form majority government
1g6nzvk	2024-10	onguardforthee	Canadian politicians trying to copy American politicians rn:
1g0xb46	2024-10	onguardforthee	"Jagmeet Singh on Instagram: ""The NDP Pharmacare Plan has passed! The Liberals tried to delay. The Conservatives tried to deny. We fought back — because like Canadians, New Democrats believe in taking care of one another. We believe that everyone should have access to the medication they need to s"
1g0w9ny	2024-10	onguardforthee	Senate passes Liberal, NDP bill to cover diabetes and birth control medication
1fzsqnx	2024-10	onguardforthee	Despite what the haters say, the federal Liberals can boast of many accomplishments
1fwd2nv	2024-10	onguardforthee	Poilievre moving down a sliding scale toward admitting he’ll cut some Liberal social programs
1ftnn6t	2024-10	onguardforthee	Liberal MP says he shouldn’t be silenced in the House of Commons for linking Conservatives to Vladimir Putin
1ftfw4m	2024-10	onguardforthee	Liberal MP says he shouldn’t be silenced in the House of Commons for linking Conservatives to Vladimir Putin
1gectcy	2024-10	onguardforthee	The Conservative Leader has voted 5 times against your right to choose. His MPs have introduced anti-choice bills and donated to anti-choice groups. For me and New Democrats, abortion is healthcare. It’s a right that must be expanded with better access.
1ge18tr	2024-10	onguardforthee	Trump’s popularity has risen among Canada’s Conservatives. When should we start to worry?
1gdv02w	2024-10	onguardforthee	Bots and brain rot: The top results on Twitter for 'Elections BC' are right-wing individuals claiming fraud conspiracies because the Conservatives didn't win.
1gc7i0o	2024-10	onguardforthee	Conservative candidate uses racist slur for First Nations people
1gbbbht	2024-10	onguardforthee	Canada is not the broken country the Conservatives need you to think it is
1gb8izw	2024-10	onguardforthee	NDP plan motion to push back against anti-abortion 'creep' from Conservatives
1gazyhf	2024-10	onguardforthee	Trudeau suggests Conservative Leader has something to hide by refusing a national security clearance
1gantkr	2024-10	onguardforthee	[BC] Green leader spoke with NDP’s Eby, but didn’t pick up when Conservatives called
1ga0504	2024-10	onguardforthee	Conservatives claiming that Trudeau is “pro-China” is bunkum
1g9n469	2024-10	onguardforthee	Mark Carney says Conservative Party 'doesn’t understand the economy' on MP’s podcast
1g9lr1p	2024-10	onguardforthee	Conservative premiers are the problem
1g92eho	2024-10	onguardforthee	Country first, party second. A Canadian was killed by a foreign country on Canadian soil. Our nation's democracy is under threat. What is the response of Pierre Poilievre's Conservatives? Laughter.
1g8aid2	2024-10	onguardforthee	Meet the Extreme, Far-Right BC Conservative Candidates Who Are Now Legislators Following BC’s Wild Election
1g7xfbk	2024-10	onguardforthee	No clear winner in B.C. election race between NDP, Conservatives
1g7x4h6	2024-10	onguardforthee	Every Conservative accusation is a confession.
1g6yk4o	2024-10	onguardforthee	"[Video] Alistair MacGregor: ""The only federal party leader who is refusing to obtain top security clearance is Mr. Poilievre of the Conservatives... Perhaps it allows him to continue to talk on Twitter about things he absolutely knows nothing about"""
1g6njgd	2024-10	onguardforthee	If you live in an eligible province, and you filed your taxes, you’ll get the Canada Carbon Rebate automatically — four times a year. But Conservative politicians won’t tell you that.
1g63gr6	2024-10	onguardforthee	BC Conservative leader clarifies that every batshit thing he's ever said was a misunderstanding unless you agree with it
1g5xk2w	2024-10	onguardforthee	Conservative voter admitting to stealing mail on twitter
1g53d8a	2024-10	onguardforthee	Trudeau tells inquiry some Conservative parliamentarians are involved in foreign interference
1g53cm8	2024-10	onguardforthee	"rime Minister Trudeau says he knows the names of ""a number of parliamentarians, former parliamentarians, and or candidates"" of the Conservative Party he says there is ""clear intelligence"" regarding their engagement with or risk of foreign interference."
1g40chh	2024-10	onguardforthee	Did anyone have “Sandy Hook Denialist” on their bingo card? Brent Chapman, BC Conservative and disgusting human being is still not stepping down….
1g2ww1c	2024-10	onguardforthee	Eby makes plea to Green voters to support NDP to help keep Conservatives from office
1g1feiq	2024-10	onguardforthee	B.C. Conservatives stand by candidate who called Palestinian children 'inbred'
1g0w636	2024-10	onguardforthee	‘Not surprising’ Trudeau regrets breaking electoral reform pledge as Conservatives soar, says Fair Vote Canada
1g0mx5d	2024-10	onguardforthee	Canada’s mainstream media is biased towards the Conservatives
1fz9uyd	2024-10	onguardforthee	BC Conservative candidate Sheldon Clare argued residential schools actually created positive ‘opportunities’ for indigenous children 
1fxvdm4	2024-10	onguardforthee	BC Conservative Leader John Rustad Suggests Province Would Participate in ‘Nuremberg’-Style COVID-19 Trials
1fwa7yg	2024-10	onguardforthee	Poilievre’s ‘common sense’ narrative is ‘reheated Conservative coffee’
1fvjwin	2024-10	onguardforthee	Conservative politicians support bullying
1ftvbvi	2024-10	onguardforthee	The six Chiefs of the Wolastoqey Nation call on the “Progressive” Conservative Party in New Brunswick to remove Sherry Wilson from its candidate roster in this election following her appalling statement comparing the residential school atrocities to “parental rights.”
1gens9a	2024-10	onguardforthee	Saskatchewan NDP sees best election result in almost 20 years despite loss  | Globalnews.ca
1gedzc5	2024-10	onguardforthee	B.C. NDP hangs on to power, will form next government CBC projects
1gcvx4t	2024-10	onguardforthee	NDP on track to flip Surrey-Guildford, maybe Kelowna Centre too
1g9lef9	2024-10	onguardforthee	Saskatchewan NDP gaining momentum among decided voters, new poll says
